{
  "$schema": "../catalog/schemas/collection.schema.json",
  "schemaVersion": "1.0",
  "id": "design",
  "name": "Design",
  "description": "Design reasoning, systems, trustworthy flows, handoff, visual research, interface states, Affinity automation, and brand naming workflows.",
  "version": "0.3.0",
  "skills": [
    "balise-affinity",
    "balise-affinity-mcp",
    "balise-brand-naming",
    "balise-design-system",
    "balise-handoff",
    "balise-trustworthy-flows",
    "balise-ui-states",
    "balise-visual-references"
  ]
}
